{
  "schema_version": 1,
  "task_id": "gc-simulation",
  "agent": "simulation",
  "created_at": "2026-08-08T00:00:00Z",
  "instruction": "You are the simulation. Propose EXACTLY ONE typed ActionProposal and execute nothing. Emit ONLY these fields: requested_by_role='simulation', action_type='compute_nve_drift', schema_version=1, run_id='stageC-golden', stage='validation', requested_at='2026-08-08T00:00:00Z', rationale='Assess NVE energy drift as an MD-stability diagnostic; no MD/DFT run.', idempotency_key='stageC-sim-0001', dry_run=true, parameters={}. Do not run MD, DFT, or submit any scheduler job. Do not add any other fields.",
  "inputs": [],
  "criteria": [],
  "constraints": [
    "propose only: dry-run; no MD/DFT; no scheduler submission"
  ],
  "context": {}
}
